{
  "$schema": "../../ui_manifest.schema.json",
  "schema_version": 1,
  "pedal_id": "dyna_comp",
  "display_name": "Dyna Comp",
  "enclosure": "125B_PORTRAIT",
  "label_style": "printed",
  "knob_style": { "family": "classic", "color": "red" },
  "led": { "color": "red" },
  "controls": [
    { "id": "output", "label": "OUTPUT", "kind": "knob", "range": { "min": 0.0, "max": 1.0 }, "default": 0.5 },
    { "id": "sensitivity", "label": "SENS", "kind": "knob", "range": { "min": 0.0, "max": 1.0 }, "default": 0.5 },
    { "id": "bypass", "label": "BYPASS", "kind": "switch", "default": false }
  ]
}
