{
  "$schema": "../../ui_manifest.schema.json",
  "schema_version": 1,
  "pedal_id": "fuzz_face",
  "display_name": "Fuzz Face",
  "enclosure": "125B_PORTRAIT",
  "label_style": "printed",
  "knob_style": { "family": "classic", "color": "white" },
  "led": { "color": "red" },
  "controls": [
    { "id": "volume", "label": "VOLUME", "kind": "knob", "range": { "min": 0.0, "max": 1.0 }, "default": 0.6 },
    { "id": "fuzz", "label": "FUZZ", "kind": "knob", "range": { "min": 0.0, "max": 1.0 }, "default": 0.7 },
    { "id": "bypass", "label": "BYPASS", "kind": "switch", "default": false }
  ]
}
