{
  "$schema": "../../ui_manifest.schema.json",
  "schema_version": 1,
  "pedal_id": "proco_rat",
  "display_name": "ProCo RAT",
  "enclosure": "125B_PORTRAIT",
  "label_style": "printed",
  "knob_style": { "family": "classic", "color": "black" },
  "led": { "color": "red" },
  "controls": [
    { "id": "distortion", "label": "DIST", "kind": "knob", "range": { "min": 0.0, "max": 1.0 }, "default": 0.6 },
    { "id": "filter", "label": "FILTER", "kind": "knob", "range": { "min": 0.0, "max": 1.0 }, "default": 0.5 },
    { "id": "volume", "label": "VOL", "kind": "knob", "range": { "min": 0.0, "max": 1.0 }, "default": 0.5 },
    { "id": "bypass", "label": "BYPASS", "kind": "switch", "default": false }
  ]
}
