{
  "$schema": "../../ui_manifest.schema.json",
  "schema_version": 1,
  "pedal_id": "tube_screamer",
  "display_name": "Tube Screamer",
  "enclosure": "125B_PORTRAIT",
  "label_style": "printed",
  "knob_style": { "family": "classic", "color": "cream" },
  "led": { "color": "green" },
  "controls": [
    { "id": "drive", "label": "DRIVE", "kind": "knob", "range": { "min": 0.0, "max": 1.0 }, "default": 0.5 },
    { "id": "tone", "label": "TONE", "kind": "knob", "range": { "min": 0.0, "max": 1.0 }, "default": 0.5 },
    { "id": "level", "label": "LEVEL", "kind": "knob", "range": { "min": 0.0, "max": 1.0 }, "default": 0.5 },
    { "id": "bypass", "label": "BYPASS", "kind": "switch", "default": false }
  ]
}
